{
  "id": "AC.L2-3.1.10",
  "control_number": "AC.L2-3.1.10",
  "title": "Use Session Lock with Pattern-Hiding Displays After Period of Inactivity",
  "description": "use session lock with pattern-hiding displays to prevent access and viewing of data after a period of inactivity",
  "category": "AC",
  "target_os": [
    "debian",
    "linux",
    "windows_client",
    "windows_server"
  ],
  "check_details": {
    "windows_client": {
      "checks": [
        {
          "check_type": "command",
          "name": "Period of Inactivity for Session Lock is Defined",
          "sub_control": "a",
          "command": "NA",
          "expected_result": "NA",
          "purpose": "Definition of the inactivity period for session lock is an organizational GRC documentation concern and is not technically verifiable via automated check on Windows Client"
        },
        {
          "check_type": "command",
          "name": "Session Lock is Initiated After Defined Period of Inactivity",
          "sub_control": "b",
          "command": "cs_f(access_control.session_lock_wc)",
          "expected_result": "True",
          "purpose": "Verify that a screen saver or session lock is configured to activate after no more than 15 minutes of inactivity and requires password to unlock via Group Policy or registry"
        },
        {
          "check_type": "command",
          "name": "Previously Visible Information is Concealed via Pattern-Hiding Display",
          "sub_control": "c",
          "command": "cs_f(access_control.pattern_hiding_wc)",
          "expected_result": "True",
          "purpose": "Confirm that the screen saver is configured to display a blank or pattern-hiding screen rather than a transparent or preview display when the session lock activates"
        }
      ]
    },
    "windows_server": {
      "checks": [
        {
          "check_type": "command",
          "name": "Period of Inactivity for Session Lock is Defined",
          "sub_control": "a",
          "command": "NA",
          "expected_result": "NA",
          "purpose": "Definition of the inactivity period for session lock is an organizational GRC documentation concern and is not technically verifiable via automated check on Windows Server"
        },
        {
          "check_type": "command",
          "name": "Session Lock is Initiated After Defined Period of Inactivity",
          "sub_control": "b",
          "command": "cs_f(access_control.session_lock_ws)",
          "expected_result": "True",
          "purpose": "Verify that a screen saver or session lock is configured to activate after no more than 15 minutes of inactivity and requires password to unlock via Group Policy or registry"
        },
        {
          "check_type": "command",
          "name": "Previously Visible Information is Concealed via Pattern-Hiding Display",
          "sub_control": "c",
          "command": "cs_f(access_control.pattern_hiding_ws)",
          "expected_result": "True",
          "purpose": "Confirm that the screen saver is configured to display a blank or pattern-hiding screen and that RDP idle session limits are enforced to disconnect inactive sessions"
        }
      ]
    },
    "linux": {
      "checks": [
        {
          "check_type": "command",
          "name": "Period of Inactivity for Session Lock is Defined",
          "sub_control": "a",
          "command": "NA",
          "expected_result": "NA",
          "purpose": "Definition of the inactivity period for session lock is an organizational GRC documentation concern and is not technically verifiable via automated check on Linux"
        },
        {
          "check_type": "command",
          "name": "Session Lock is Initiated After Defined Period of Inactivity",
          "sub_control": "b",
          "command": "cs_f(access_control.session_lock_lx)",
          "expected_result": "True",
          "purpose": "Verify that SSH idle timeout is configured via ClientAliveInterval and ClientAliveCountMax, and that TMOUT is set for shell sessions to lock after the defined inactivity period"
        },
        {
          "check_type": "command",
          "name": "Previously Visible Information is Concealed via Pattern-Hiding Display",
          "sub_control": "c",
          "command": "cs_f(access_control.pattern_hiding_lx)",
          "expected_result": "True",
          "purpose": "Confirm that shell sessions are terminated or locked on inactivity via TMOUT and that any GUI session lock is configured to blank the screen rather than show a preview"
        }
      ]
    },
    "debian": {
      "checks": [
        {
          "check_type": "command",
          "name": "Period of Inactivity for Session Lock is Defined",
          "sub_control": "a",
          "command": "NA",
          "expected_result": "NA",
          "purpose": "Definition of the inactivity period for session lock is an organizational GRC documentation concern and is not technically verifiable via automated check on Debian"
        },
        {
          "check_type": "command",
          "name": "Session Lock is Initiated After Defined Period of Inactivity",
          "sub_control": "b",
          "command": "cs_f(access_control.session_lock_lx)",
          "expected_result": "True",
          "purpose": "Verify that SSH idle timeout is configured via ClientAliveInterval and ClientAliveCountMax, and that TMOUT is set for shell sessions to lock after the defined inactivity period"
        },
        {
          "check_type": "command",
          "name": "Previously Visible Information is Concealed via Pattern-Hiding Display",
          "sub_control": "c",
          "command": "cs_f(access_control.pattern_hiding_lx)",
          "expected_result": "True",
          "purpose": "Confirm that shell sessions are terminated or locked on inactivity via TMOUT and that any GUI session lock is configured to blank the screen rather than show a preview"
        }
      ]
    }
  },
  "severity": "Medium",
  "remediation": "Instructions to remediate non-compliance",
  "tags": [
    "AC",
    "AC.L2-3.1.10"
  ]
}