{
  "id": "IA.L2-3.5.11",
  "control_number": "IA.L2-3.5.11",
  "title": "Obscure Feedback of Authentication Information",
  "description": "Obscure feedback of authentication information during the authentication process to protect the information from possible exploitation/use by unauthorized individuals.",
  "category": "IA",
  "target_os": [
    "debian",
    "linux",
    "windows_client",
    "windows_server"
  ],
  "check_details": {
    "windows_client": {
      "checks": [
        {
          "check_type": "command",
          "name": "Password is Masked During Entry",
          "sub_control": "a",
          "command": "cs_f(identification_authentication.password_masking_wc)",
          "expected_result": "True",
          "purpose": "Verify the Windows logon screen masks password characters and does not display them in clear text during entry"
        },
        {
          "check_type": "command",
          "name": "Last Logged-On Username is Not Displayed",
          "sub_control": "b",
          "command": "cs_f(identification_authentication.no_last_username_wc)",
          "expected_result": "True",
          "purpose": "Confirm the Interactive logon: Do not display last user name GPO setting is enabled to prevent username enumeration at the logon screen"
        },
        {
          "check_type": "command",
          "name": "Detailed Error Messages are Suppressed on Authentication Failure",
          "sub_control": "c",
          "command": "cs_f(identification_authentication.auth_error_suppressed_wc)",
          "expected_result": "True",
          "purpose": "Verify authentication failure messages do not reveal whether the username or password was incorrect to prevent user enumeration"
        }
      ]
    },
    "windows_server": {
      "checks": [
        {
          "check_type": "command",
          "name": "Last Logged-On Username is Not Displayed",
          "sub_control": "a",
          "command": "cs_f(identification_authentication.no_last_username_ws)",
          "expected_result": "True",
          "purpose": "Confirm the Interactive logon: Do not display last user name GPO setting is enabled on this server"
        },
        {
          "check_type": "command",
          "name": "Detailed Error Messages are Suppressed on Authentication Failure",
          "sub_control": "b",
          "command": "cs_f(identification_authentication.auth_error_suppressed_ws)",
          "expected_result": "True",
          "purpose": "Verify authentication failure messages do not reveal account enumeration information"
        },
        {
          "check_type": "command",
          "name": "Logon Banner Does Not Reveal System or User Information",
          "sub_control": "c",
          "command": "cs_f(identification_authentication.logon_banner_safe_ws)",
          "expected_result": "True",
          "purpose": "Confirm the pre-logon banner message does not reveal usernames, system names, or configuration details that could assist an attacker"
        }
      ]
    },
    "linux": {
      "checks": [
        {
          "check_type": "command",
          "name": "SSH Does Not Reveal Whether Username or Password Failed",
          "sub_control": "a",
          "command": "cs_f(identification_authentication.ssh_generic_auth_error_lx)",
          "expected_result": "True",
          "purpose": "Verify sshd is configured to provide a generic authentication failure message and does not distinguish between invalid username and invalid password"
        },
        {
          "check_type": "command",
          "name": "PAM Does Not Display Verbose Authentication Failure Reasons",
          "sub_control": "b",
          "command": "cs_f(identification_authentication.pam_auth_obscured_lx)",
          "expected_result": "True",
          "purpose": "Confirm PAM modules do not output verbose failure messages that reveal account existence or credential specifics"
        },
        {
          "check_type": "command",
          "name": "SSH Login Banner Does Not Reveal System Details",
          "sub_control": "c",
          "command": "cs_f(identification_authentication.ssh_banner_safe_lx)",
          "expected_result": "True",
          "purpose": "Verify the SSH banner configured in sshd_config does not reveal hostname, OS version, or kernel information to unauthenticated users"
        }
      ]
    },
    "debian": {
      "checks": [
        {
          "check_type": "command",
          "name": "SSH Does Not Reveal Whether Username or Password Failed",
          "sub_control": "a",
          "command": "cs_f(identification_authentication.ssh_generic_auth_error_lx)",
          "expected_result": "True",
          "purpose": "Verify sshd provides a generic authentication failure message on Debian"
        },
        {
          "check_type": "command",
          "name": "PAM Does Not Display Verbose Authentication Failure Reasons",
          "sub_control": "b",
          "command": "cs_f(identification_authentication.pam_auth_obscured_lx)",
          "expected_result": "True",
          "purpose": "Confirm PAM modules do not output verbose failure messages on Debian"
        },
        {
          "check_type": "command",
          "name": "SSH Login Banner Does Not Reveal System Details",
          "sub_control": "c",
          "command": "cs_f(identification_authentication.ssh_banner_safe_lx)",
          "expected_result": "True",
          "purpose": "Verify the SSH banner does not reveal hostname, OS version, or kernel information on Debian"
        }
      ]
    }
  },
  "severity": "Medium",
  "remediation": "Enable the Interactive logon: Do not display last user name GPO setting. Ensure authentication failure messages use generic wording. On Linux, configure sshd to use a generic failure message and ensure the SSH banner file does not contain OS or kernel details. Review /etc/issue and /etc/issue.net to remove system-identifying information.",
  "tags": [
    "IA",
    "IA.L2-3.5.11"
  ]
}