{
  "id": "SC.L2-3.13.14",
  "control_number": "SC.L2-3.13.14",
  "title": "Control and Monitor the Use of VoIP Technologies",
  "description": "Control and monitor the use of Voice over Internet Protocol (VoIP) technologies.",
  "category": "SC",
  "target_os": [
    "debian",
    "linux",
    "windows_client",
    "windows_server"
  ],
  "check_details": {
    "windows_client": {
      "checks": [
        {
          "check_type": "command",
          "name": "VoIP Usage Policy Documented",
          "sub_control": "a",
          "command": "NA",
          "expected_result": "NA",
          "purpose": "Verify a documented policy identifies authorized VoIP technologies, usage restrictions, and monitoring requirements \u00e2\u20ac\u201d policy review only"
        },
        {
          "check_type": "command",
          "name": "SIP/VoIP Ports Controlled by Firewall",
          "sub_control": "b",
          "command": "cs_f(system_communications_protection.voip_ports_controlled_wc)",
          "expected_result": "True",
          "purpose": "Verify SIP ports (5060, 5061) are either not open or governed by explicit Windows Firewall rules to ensure only authorized VoIP traffic is permitted"
        },
        {
          "check_type": "command",
          "name": "VoIP Traffic Monitored",
          "sub_control": "c",
          "command": "NA",
          "expected_result": "NA",
          "purpose": "Verify VoIP communications are logged and monitored per the organizational security monitoring program \u00e2\u20ac\u201d requires manual verification"
        }
      ]
    },
    "windows_server": {
      "checks": [
        {
          "check_type": "command",
          "name": "VoIP Usage Policy Documented",
          "sub_control": "a",
          "command": "NA",
          "expected_result": "NA",
          "purpose": "Verify a documented policy identifies authorized VoIP technologies and usage controls \u00e2\u20ac\u201d policy review only"
        },
        {
          "check_type": "command",
          "name": "SIP/VoIP Ports Controlled by Firewall",
          "sub_control": "b",
          "command": "cs_f(system_communications_protection.voip_ports_controlled_ws)",
          "expected_result": "True",
          "purpose": "Verify SIP ports 5060/5061 are controlled by firewall rules on the server to restrict unauthorized VoIP sessions"
        },
        {
          "check_type": "command",
          "name": "VoIP Traffic Monitored",
          "sub_control": "c",
          "command": "NA",
          "expected_result": "NA",
          "purpose": "Verify VoIP communications are logged and subject to security monitoring on the server \u00e2\u20ac\u201d requires manual verification"
        },
        {
          "check_type": "command",
          "name": "Unauthorized VoIP Applications Blocked",
          "sub_control": "d",
          "command": "NA",
          "expected_result": "NA",
          "purpose": "Verify application control policies block unauthorized VoIP clients \u00e2\u20ac\u201d requires AppLocker/WDAC policy review"
        }
      ]
    },
    "linux": {
      "checks": [
        {
          "check_type": "command",
          "name": "VoIP Usage Policy Documented",
          "sub_control": "a",
          "command": "NA",
          "expected_result": "NA",
          "purpose": "Verify a documented policy governs VoIP use including authorized technologies and monitoring \u00e2\u20ac\u201d policy review only"
        },
        {
          "check_type": "command",
          "name": "SIP/VoIP Ports Not Unexpectedly Open",
          "sub_control": "b",
          "command": "cs_f(system_communications_protection.voip_ports_lx)",
          "expected_result": "True",
          "purpose": "Verify SIP ports 5060/5061 are not unexpectedly listening, or are controlled by iptables/firewalld rules to restrict unauthorized VoIP sessions"
        },
        {
          "check_type": "command",
          "name": "VoIP Traffic Monitored",
          "sub_control": "c",
          "command": "NA",
          "expected_result": "NA",
          "purpose": "Verify VoIP communications are subject to security monitoring and logging \u00e2\u20ac\u201d requires manual verification"
        }
      ]
    },
    "debian": {
      "checks": [
        {
          "check_type": "command",
          "name": "VoIP Usage Policy Documented",
          "sub_control": "a",
          "command": "NA",
          "expected_result": "NA",
          "purpose": "Verify a documented policy governs VoIP use including authorized technologies and monitoring \u00e2\u20ac\u201d policy review only"
        },
        {
          "check_type": "command",
          "name": "SIP/VoIP Ports Not Unexpectedly Open",
          "sub_control": "b",
          "command": "cs_f(system_communications_protection.voip_ports_lx)",
          "expected_result": "True",
          "purpose": "Verify SIP ports 5060/5061 are not unexpectedly listening, or are controlled by iptables/firewalld rules to restrict unauthorized VoIP sessions"
        },
        {
          "check_type": "command",
          "name": "VoIP Traffic Monitored",
          "sub_control": "c",
          "command": "NA",
          "expected_result": "NA",
          "purpose": "Verify VoIP communications are subject to security monitoring and logging \u00e2\u20ac\u201d requires manual verification"
        }
      ]
    }
  },
  "severity": "Medium",
  "remediation": "Document a VoIP usage policy identifying authorized applications and monitoring requirements. Configure Windows Firewall rules to control SIP ports 5060/5061. Use AppLocker to allow only approved VoIP clients. On Linux, configure iptables/firewalld rules to restrict SIP ports to authorized sources only.",
  "tags": [
    "SC",
    "SC.L2-3.13.14"
  ]
}