{
  "id": "IA.L2-3.5.4",
  "control_number": "IA.L2-3.5.4",
  "title": "Employ Replay-Resistant Authentication Mechanisms",
  "description": "Employ replay-resistant authentication mechanisms for network access to privileged and non-privileged accounts.",
  "category": "IA",
  "target_os": [
    "debian",
    "linux",
    "windows_client",
    "windows_server"
  ],
  "check_details": {
    "windows_client": {
      "checks": [
        {
          "check_type": "command",
          "name": "NTLMv1 is Disabled",
          "sub_control": "a",
          "command": "cs_f(identification_authentication.ntlmv1_disabled_wc)",
          "expected_result": "True",
          "purpose": "Verify NTLMv1 is disabled via LAN Manager Authentication Level registry setting (must be 3, 4, or 5)"
        },
        {
          "check_type": "command",
          "name": "Kerberos is the Preferred Authentication Protocol",
          "sub_control": "b",
          "command": "cs_f(identification_authentication.kerberos_preferred_wc)",
          "expected_result": "True",
          "purpose": "Confirm the system is domain joined and uses Kerberos (a nonce-based replay-resistant protocol) for network authentication"
        },
        {
          "check_type": "command",
          "name": "Windows Hello for Business or Smart Card is Configured",
          "sub_control": "c",
          "command": "cs_f(identification_authentication.smartcard_or_whfb_wc)",
          "expected_result": "True",
          "purpose": "Verify a phishing-resistant, replay-resistant MFA mechanism (smart card, FIDO2, Windows Hello for Business) is configured"
        }
      ]
    },
    "windows_server": {
      "checks": [
        {
          "check_type": "command",
          "name": "NTLMv1 is Disabled",
          "sub_control": "a",
          "command": "cs_f(identification_authentication.ntlmv1_disabled_ws)",
          "expected_result": "True",
          "purpose": "Verify NTLMv1 is disabled via LAN Manager Authentication Level (must be 3, 4, or 5)"
        },
        {
          "check_type": "command",
          "name": "Kerberos is the Preferred Authentication Protocol",
          "sub_control": "b",
          "command": "cs_f(identification_authentication.kerberos_preferred_ws)",
          "expected_result": "True",
          "purpose": "Confirm the server is domain joined and Kerberos is used for network authentication by default"
        },
        {
          "check_type": "command",
          "name": "Extended Protection for Authentication is Enabled",
          "sub_control": "c",
          "command": "cs_f(identification_authentication.epa_enabled_ws)",
          "expected_result": "True",
          "purpose": "Verify Extended Protection for Authentication (EPA) is enabled on IIS and LDAP to prevent relay attacks"
        },
        {
          "check_type": "command",
          "name": "NTLM Restrictions are Enforced via GPO",
          "sub_control": "d",
          "command": "cs_f(identification_authentication.ntlm_restrictions_ws)",
          "expected_result": "True",
          "purpose": "Confirm Network Security: Restrict NTLM GPO settings are configured to audit or deny NTLM authentication where Kerberos is available"
        }
      ]
    },
    "linux": {
      "checks": [
        {
          "check_type": "command",
          "name": "SSH Uses Replay-Resistant Key Exchange Algorithms",
          "sub_control": "a",
          "command": "cs_f(identification_authentication.ssh_replay_resistant_lx)",
          "expected_result": "True",
          "purpose": "Verify sshd_config restricts KexAlgorithms to modern replay-resistant algorithms (e.g., curve25519-sha256, ecdh-sha2-nistp256)"
        },
        {
          "check_type": "command",
          "name": "TOTP or Hardware Token MFA is Configured",
          "sub_control": "b",
          "command": "cs_f(identification_authentication.totp_configured_lx)",
          "expected_result": "True",
          "purpose": "Confirm a TOTP or OTP-based MFA mechanism (pam_google_authenticator, pam_oath) is configured, providing time-based one-time passwords that are replay-resistant"
        },
        {
          "check_type": "command",
          "name": "SSH Protocol 1 is Disabled",
          "sub_control": "c",
          "command": "cs_f(identification_authentication.ssh_proto1_disabled_lx)",
          "expected_result": "True",
          "purpose": "Verify SSH Protocol 1 (vulnerable to replay attacks) is not available or enabled in sshd_config"
        }
      ]
    },
    "debian": {
      "checks": [
        {
          "check_type": "command",
          "name": "SSH Uses Replay-Resistant Key Exchange Algorithms",
          "sub_control": "a",
          "command": "cs_f(identification_authentication.ssh_replay_resistant_lx)",
          "expected_result": "True",
          "purpose": "Verify sshd_config restricts KexAlgorithms to modern replay-resistant algorithms on Debian"
        },
        {
          "check_type": "command",
          "name": "TOTP or Hardware Token MFA is Configured",
          "sub_control": "b",
          "command": "cs_f(identification_authentication.totp_configured_lx)",
          "expected_result": "True",
          "purpose": "Confirm a TOTP or OTP-based MFA mechanism is configured, providing replay-resistant authentication"
        },
        {
          "check_type": "command",
          "name": "SSH Protocol 1 is Disabled",
          "sub_control": "c",
          "command": "cs_f(identification_authentication.ssh_proto1_disabled_lx)",
          "expected_result": "True",
          "purpose": "Verify SSH Protocol 1 is not available or enabled in sshd_config on Debian"
        }
      ]
    }
  },
  "severity": "High",
  "remediation": "Disable NTLMv1 by setting LAN Manager Authentication Level to 5 (NTLMv2 only). Enable EPA on IIS and LDAP. Configure GPO to restrict NTLM. Deploy phishing-resistant MFA (FIDO2, smart card, Windows Hello). On Linux, restrict SSH KexAlgorithms to modern algorithms and deploy TOTP MFA via pam_google_authenticator.",
  "tags": [
    "IA",
    "IA.L2-3.5.4"
  ]
}