{
  "id": "SC.L2-3.13.15",
  "control_number": "SC.L2-3.13.15",
  "title": "Protect the Authenticity of Communications Sessions",
  "description": "Protect the authenticity of communications sessions.",
  "category": "SC",
  "target_os": [
    "debian",
    "linux",
    "windows_client",
    "windows_server"
  ],
  "check_details": {
    "windows_client": {
      "checks": [
        {
          "check_type": "command",
          "name": "SMB Client Signing is Required",
          "sub_control": "a",
          "command": "cs_f(system_communications_protection.smb_signing_wc)",
          "expected_result": "True",
          "purpose": "Verify LanmanWorkstation RequireSecuritySignature = 1 to authenticate SMB sessions and prevent man-in-the-middle and relay attacks"
        },
        {
          "check_type": "command",
          "name": "TLS Certificate Validation is Enabled",
          "sub_control": "b",
          "command": "cs_f(system_communications_protection.tls_cert_validation_wc)",
          "expected_result": "True",
          "purpose": "Verify certificate revocation checking is not disabled, ensuring TLS sessions are authenticated against valid, non-revoked certificates"
        },
        {
          "check_type": "command",
          "name": "Session Authenticity Policy Documented",
          "sub_control": "c",
          "command": "NA",
          "expected_result": "NA",
          "purpose": "Verify organizational policy requires mutual authentication for all communications sessions handling CUI \u00e2\u20ac\u201d policy review only"
        }
      ]
    },
    "windows_server": {
      "checks": [
        {
          "check_type": "command",
          "name": "SMB Server Signing is Required",
          "sub_control": "a",
          "command": "cs_f(system_communications_protection.smb_signing_ws)",
          "expected_result": "True",
          "purpose": "Verify LanmanServer RequireSecuritySignature = 1 to mandate SMB signing on the server side, authenticating all file sharing sessions"
        },
        {
          "check_type": "command",
          "name": "LDAP Server Signing is Required",
          "sub_control": "b",
          "command": "cs_f(system_communications_protection.ldap_signing_required_ws)",
          "expected_result": "True",
          "purpose": "Verify LDAPServerIntegrity = 2 to require LDAP signing, protecting the authenticity of directory service communications"
        },
        {
          "check_type": "command",
          "name": "TLS Certificate Validation is Enabled",
          "sub_control": "c",
          "command": "cs_f(system_communications_protection.tls_cert_validation_ws)",
          "expected_result": "True",
          "purpose": "Confirm TLS certificate revocation checking is not disabled on the server"
        },
        {
          "check_type": "command",
          "name": "Kerberos Authentication is in Use",
          "sub_control": "d",
          "command": "cs_f(system_communications_protection.kerberos_auth_ws)",
          "expected_result": "True",
          "purpose": "Verify the server is domain-joined to confirm Kerberos mutual authentication is available for all domain communications sessions"
        }
      ]
    },
    "linux": {
      "checks": [
        {
          "check_type": "command",
          "name": "SSH HostbasedAuthentication is Disabled",
          "sub_control": "a",
          "command": "cs_f(system_communications_protection.ssh_hostbased_disabled_lx)",
          "expected_result": "True",
          "purpose": "Verify SSH HostbasedAuthentication is no, preventing weaker host-based trust that could undermine session authenticity"
        },
        {
          "check_type": "command",
          "name": "SSH StrictHostKeyChecking is Enabled",
          "sub_control": "b",
          "command": "cs_f(system_communications_protection.ssh_strict_host_lx)",
          "expected_result": "True",
          "purpose": "Verify StrictHostKeyChecking = yes in /etc/ssh/ssh_config to enforce host key verification on outbound SSH sessions, preventing connection to impersonated hosts"
        },
        {
          "check_type": "command",
          "name": "Session Authenticity Policy Documented",
          "sub_control": "c",
          "command": "NA",
          "expected_result": "NA",
          "purpose": "Verify organizational policy requires authentication for all communications sessions \u00e2\u20ac\u201d policy review only"
        }
      ]
    },
    "debian": {
      "checks": [
        {
          "check_type": "command",
          "name": "SSH HostbasedAuthentication is Disabled",
          "sub_control": "a",
          "command": "cs_f(system_communications_protection.ssh_hostbased_disabled_lx)",
          "expected_result": "True",
          "purpose": "Verify SSH HostbasedAuthentication is no, preventing weaker host-based trust that could undermine session authenticity"
        },
        {
          "check_type": "command",
          "name": "SSH StrictHostKeyChecking is Enabled",
          "sub_control": "b",
          "command": "cs_f(system_communications_protection.ssh_strict_host_lx)",
          "expected_result": "True",
          "purpose": "Verify StrictHostKeyChecking = yes in /etc/ssh/ssh_config to enforce host key verification on outbound SSH sessions, preventing connection to impersonated hosts"
        },
        {
          "check_type": "command",
          "name": "Session Authenticity Policy Documented",
          "sub_control": "c",
          "command": "NA",
          "expected_result": "NA",
          "purpose": "Verify organizational policy requires authentication for all communications sessions \u00e2\u20ac\u201d policy review only"
        }
      ]
    }
  },
  "severity": "High",
  "remediation": "Enable SMB signing via GPO (require it on both client and server). Enable LDAP signing (LDAPServerIntegrity = 2). Ensure TLS certificate validation is active. On Linux, set HostbasedAuthentication no and StrictHostKeyChecking yes in /etc/ssh/sshd_config and ssh_config respectively, then reload sshd.",
  "tags": [
    "SC",
    "SC.L2-3.13.15"
  ]
}